{"format":"erg-patch/2","stem":"mymaps_objects","title":"Synthetic Brawl","base":{"key":"Multi.Synthetic","source":"game","sha256":{"xan":"aaaaaaaaaaaaaaaaaaaaaaaaaaaaaaaaaaaaaaaaaaaaaaaaaaaaaaaaaaaaaaaa","xom":"bbbbbbbbbbbbbbbbbbbbbbbbbbbbbbbbbbbbbbbbbbbbbbbbbbbbbbbbbbbbbbbb","hmp":"cccccccccccccccccccccccccccccccccccccccccccccccccccccccccccccccc"}},"kind":{"survivor":true},"databank":{"theme":"CAMELOT"},"water":{"level":40},"spawns":{"mode":"knots"},"hmp":{"mode":"paint"},"ops":[{"op":"set","src":16,"pos":[12.5,3,-4]},{"op":"add","frame":3,"detail":{"name":"oildrum","resource":"OilDrum","pos":[1,2,3]}},{"op":"remove","src":25},{"op":"add","frame":3,"detail":{"name":"CRATE_0","resource":"Unit","pos":[0,1,2]}},{"op":"add","frame":3,"detail":{"name":"CRATE_1","resource":"Unit","pos":[1,1,2]}},{"op":"add","frame":3,"detail":{"name":"CRATE_2","resource":"Unit","pos":[2,1,2]}},{"op":"add","frame":3,"detail":{"name":"TP_1_0","resource":"Unit","pos":[3,1,2]}},{"op":"add","frame":3,"detail":{"name":"TP_1_1","resource":"Unit","pos":[4,1,2]}},{"op":"add","frame":3,"detail":{"name":"TRIG_0","resource":"Unit","pos":[5,1,2]}},{"op":"addFrame","tmp":-1,"parent":1000,"name":"ergframe_0","pos":[4,2,-3],"size":[6,31,6]},{"op":"voxels","frame":-1,"runs":[[0,64,23]]},{"op":"hmp","heights":[[0,100,1],[9900,100,0.25]],"blend":[[0,10000,255]]}],"objects":[{"knot":"CRATE_0","type":"crate","crate":{"kind":"weapon","contents":"kWeaponHolyHandGrenade","count":1,"hitpoints":25,"parachute":false}},{"knot":"CRATE_1","type":"crate","crate":{"kind":"health","amount":50,"hitpoints":25,"parachute":false}},{"knot":"CRATE_2","type":"crate","crate":{"kind":"utility","contents":"kUtilityJetpack","count":2,"hitpoints":25,"parachute":false}},{"knot":"TP_1_0","type":"telepad","group":1},{"knot":"TP_1_1","type":"telepad","group":1},{"knot":"TRIG_0","type":"trigger","trigger":{"index":1,"radius":60,"teamCollect":0,"teamDestroy":4,"hitpoints":1,"wormCollect":false}}],"script":{"present":true,"sha256":"dddddddddddddddddddddddddddddddddddddddddddddddddddddddddddddddd"}}
